x,WORD_NOUN,,HIRAGANA_KATAKANA,,,構造化データ,こうぞうかデータ,,kouzouka deeta,dane ustrukturyzowane,informatyka,,,"GroupId: 2840769
Translate: structured data"
x,WORD_NOUN,,HIRAGANA_KATAKANA,,,非構造化データ,ひこうぞうかデータ,,hikouzouka deeta,dane nieustrukturyzowane,informatyka,,,"GroupId: 2840770
Translate: unstructured data"
x,WORD_NOUN,,KATAKANA,,,-,オープンデータ,,oopun deeta,otwarte dane,ang: open data,,,"GroupId: 2840809
Translate: open data"
x,WORD_NOUN,,HIRAGANA_KATAKANA,,,特異データ,とくいデータ,,tokui deeta,"unikalne dane
nietypowe dane",informatyka,,,"GroupId: 2379060
Translate: unique data
Translate: non-typical data"
x,WORD_NOUN,,KATAKANA_HIRAGANA,,,データ欠損,データけっそん,,deeta kesson,"niedostępność danych
brak danych",informatyka,,,"GroupId: 2310250
Translate: data unavailability
Translate: lack of data
Translate: shortage of data"
x,WORD_NOUN,,HIRAGANA,,,文字情報,もじじょうほう,,moji jouhou,"dane tekstowe
dane znakowe",informatyka,,,"GroupId: 1505410
Translate: character information
Translate: character data
Translate: textual data"
x,WORD_NOUN,,KATAKANA_HIRAGANA,,,データ収集端末,データしゅうしゅうたんまつ,,deeta shuushuu tanmatsu,"stacja wprowadzania danych
stacja gromadzenia danych",informatyka,,,"GroupId: 2310400
Translate: data input station
Translate: data collection station"
x,WORD_NOUN,,KATAKANA_HIRAGANA,,,データ入力端末,データにゅうりょくたんまつ,,deeta nyuuryoku tanmatsu,"stacja wprowadzania danych
stacja gromadzenia danych",informatyka,,,"GroupId: 2310790
Translate: data input station
Translate: data collection station"
x,WORD_NOUN,,HIRAGANA_KATAKANA,,,画像データ,がぞうデータ,,gazou deeta,"dane obrazowe
dane graficzne
cyfrowy obraz",informatyka,,,"GroupId: 2344660
Translate: image data
Translate: graphics data
Translate: digital image"
x,WORD_NOUN,,HIRAGANA_KATAKANA,,,文字符号データ要素,もじふごうデータようそ,,moji fugou deeta youso,???,informatyka,,,"GroupId: 2387210
Translate: character-coded-data-element
Translate: CC data element"
x,WORD_NOUN,,KATAKANA_HIRAGANA,,,データの先頭,データのせんとう,,deeta no sentou,początek danych,informatyka,,,"GroupId: 1081210
Translate: beginning of data"
x,WORD_NOUN,,KATAKANA_HIRAGANA,,,データビット長,データビットちょう,,deeta bitto chou,długość bitu danych,informatyka,,,"GroupId: 1081300
Translate: data bit length"
x,WORD_NOUN,,HIRAGANA_KATAKANA,,,電子データ処理,でんしデータしょり,,denshi deeta shori,elektroniczne przetwarzanie danych,informatyka,,,"GroupId: 1443330
Translate: electronic data processing
Translate: EDP"
x,WORD_NOUN,,HIRAGANA,,,赤外線通信,せきがいせんつうしん,,sekigai sentsuushin,komunikacja danych w podczerwieni,,,,"GroupId: 1997090
Translate: infrared data communication"
x,WORD_NOUN,,HIRAGANA_KATAKANA,,,電子データ交換,でんしデータこうかん,,denshi deeta koukan,elektroniczna wymiana danych,informatyka,,,"GroupId: 1998780
Translate: electronic data interchange
Translate: EDI"
x,WORD_NOUN,,KATAKANA,,,ＲＤＯ,アールディーオー,,aarudiioo,"RDO (ang: remote data object)
zdalny obiekt danych",informatyka,,,"GroupId: 2277870
Translate: remote data object
Translate: RDO"
x,WORD_NOUN,,KATAKANA_HIRAGANA,,,オンラインデータ収集システム,オンラインデータしゅうしゅうシステム,,onrain deeta shuushuu shisutemu,system zbierania danych online,informatyka,,,"GroupId: 2290100
Translate: online data gathering system"
x,WORD_NOUN,,KATAKANA_HIRAGANA,,,オンラインデータ処理,オンラインデータしょり,,onrain deeta shori,przetwarzanie danych online,informatyka,,,"GroupId: 2290110
Translate: online data processing"
x,WORD_NOUN,,KATAKANA_HIRAGANA,,,オンラインデータ入力,オンラインデータにゅうりょく,,onrain deeta nyuuryoku,wpis danych online,informatyka,,,"GroupId: 2290120
Translate: online data entry"
x,WORD_NOUN,,KATAKANA_HIRAGANA,,,データタグ形式,データタグけいしき,,deeta tagu keishiki,wzór znacznika danych,informatyka,,,"GroupId: 2309720
Translate: data tag pattern"
x,WORD_NOUN,,KATAKANA_HIRAGANA,,,データベース管理者,データベースかんりしゃ,,deetabeesu kanrisha,"administrator bazy danych
DBA (ang: Data Base Administrator)",informatyka,,,"GroupId: 2309910
Translate: Data Base Administrator
Translate: DBA"
x,WORD_NOUN,,KATAKANA_HIRAGANA,,,データリンク層,データリンクそう,,deetarin kusou,warstwa łącza danych,informatyka,,,"GroupId: 2309980
Translate: data link layer"
x,WORD_NOUN,,KATAKANA_HIRAGANA,,,データ暗号化規格,データあんごうかきかく,,deeta angouka kikaku,"Data Encryption Standard
DES","symetryczny szyfr blokowy zaprojektowany w 1975 roku przez IBM na zlecenie ówczesnego Narodowego Biura Standardów USA. Od 1976 do 2001 roku stanowił standard federalny USA, a od roku 1981 standard ANSI dla sektora prywatnego",,,"GroupId: 2310010
Translate: Data Encryption Standard
Translate: DES"
x,WORD_NOUN,,KATAKANA_HIRAGANA,,,データ依存形障害,データいぞんがたしょうがい,,deeta izongata shougai,niezdatność informacyjna,informatyka,,,"GroupId: 2310040
Translate: data-sensitive fault"
x,WORD_NOUN,,KATAKANA_HIRAGANA,,,データ回線透過性,データかいせんとうかせい,,deeta kaisen toukasei,przejrzystość obwodu danych,informatyka,,,"GroupId: 2310080
Translate: data circuit transparency"
x,WORD_NOUN,,KATAKANA_HIRAGANA,,,データ記述ファイル,データきじゅつファイル,,deeta kijutsu fairu,"plik deskryptora danych
DDF (ang: data descriptor file)",informatyka,,,"GroupId: 2310130
Translate: data descriptor file
Translate: DDF"
x,WORD_NOUN,,KATAKANA_HIRAGANA,,,データ記述レコード,データきじゅつレコード,,deeta kijutsu rekoodo,rekord deskryptora danych,informatyka,,,"GroupId: 2310140
Translate: data descriptor record"
x,WORD_NOUN,,KATAKANA_HIRAGANA,,,データ記述言語,データきじゅつげんご,,deeta kijutsu gengo,"język opisu danych
DDL (ang: Data Description Language)",informatyka,,,"GroupId: 2310150
Translate: Data Description Language
Translate: DDL"
x,WORD_NOUN,,KATAKANA_HIRAGANA,,,データ記述項,データきじゅつこう,,deeta kijutsukou,wpis opisu danych,informatyka,,,"GroupId: 2310170
Translate: data description entry"
x,WORD_NOUN,,KATAKANA_HIRAGANA,,,データ記録装置,データきろくそうち,,deeta kiroku souchi,Urządzenie do Rejestracji Danych,informatyka,,,"GroupId: 2310180
Translate: Data Recording Device"
